FILE_NAME,JOB_CLASS_TITLE,JOB_CLASS_NO,REQUIREMENT_SET_ID,REQUIREMENT_SUBSET_ID,JOB_DUTIES,EDUCATION_YEARS,SCHOOL_TYPE,EDUCATION_MAJOR,EXPERIENCE_LENGTH,FULL_TIME_PART_TIME,EXP_JOB_CLASS_TITLE,EXP_JOB_CLASS_ALT_RESP,EXP_JOB_CLASS_FUNCTION,COURSE_LENGTH,DRIVERS_LICENSE_REQ,DRIV_LIC_TYPE,EXAM_TYPE,SALARY_START,SALARY_END,ENTRY_SALARY_DWP,REQUIREMENTS,APPLICATION_DEADLINE,OPEN_DATE,SALARY_START_NUM,SALARY_END_NUM,OPEN_YEAR,OPEN_MONTH,EXP_NUM
ASPHALT PLANT OPERATOR 4143 102414.txt,ASPHALT PLANT OPERATOR,4143,1,,"An Asphalt Plant Operator performs routine operating functions, and maintenance, inspection and repair activities of asphalt plant machinery and its appurtenances; or measures, weighs and mixes bituminous materials and aggregate, according to formula, by operating mixing machinery; operates dryers, pumps, and auxiliary equipment or assists in such work; and performs a variety of maintenance and regular repair tasks some of which are performed in confined spaces and heights above 75 feet. An Asphalt Plant Operator monitors and evaluates asphalt plant operations and makes adjustments and corrections when necessary, and reads and interprets operation/maintenance manuals.",,,,One year,full-time,,,"with the City of Los Angeles performing routine operation and maintenance, inspection and repair activities of asphalt plant machinery and equipment, including motors, compressors, pumps, conveyors and dryers;",,,,OPEN,"$46,165","$57,336",,"1. One year of full-time paid experience with the City of Los Angeles performing routine operation and maintenance, inspection and repair activities of asphalt plant machinery and equipment, including motors, compressors, pumps, conveyors and dryers; or 
2. Eighteen months of full-time paid experience performing the duties as described in Requirement #1. 
3. A valid California Class B license is required.  Applicants will be disqualified and not eligible for hire if within the past 36 months they were convicted of a major moving violation, such as driving under the influence of alcohol and/or drugs, and may be disqualified if there are three or more moving violations and/or at-fault accidents within the past 36 months.","THURSDAYNOVEMBER 6, 2014",10-24-14,46165.0,57336.0,2014,10,1
LEGISLATIVE ASSISTANT 1182 091815.txt,LEGISLATIVE ASSISTANT,1182,,,"A Legislative Assistant serves one or more Council committees, or may act as the City Clerk's representative at Council meetings, preparing and checking agendas and reports, attending meetings, maintaining records, providing minutes and supplying information about the Council or Council committee activities.",,,,,,,,,,,,INT_DEPT_PROM,"$76,379","$111,624",,,"THURSDAYOCTOBER 1, 2015",09-18-15,76379.0,111624.0,2015,9,0
SENIOR ADMINISTRATIVE CLERK 1368 062918 REV 091718.txt,SENIOR ADMINISTRATIVE CLERK,1368,,,"A Senior Administrative Clerk performs difficult clerical work of a responsible nature requiring frequent exercise of independent judgment and a good knowledge of the functions of the organizational unit in which the position is located. A Senior Administrative Clerk works closely with employees and members of the public, typically utilizes a personal computer to complete daily tasks, may provide training, and may assign, review, and evaluate the work of other clerical employees. A Senior Administrative Clerk may also be required to work night or early morning shifts, weekends and holidays.",,,,One year,full-time,,,,,P,,INT_DEPT_PROM,"$46,374","$67,818","$53,494 to $66,461",One year of full-time paid office clerical experience.,"SATURDAYSEPTEMBER 7, 2019 and SUNDAY, SEPTEMBER 8, 2019",06-29-18,46374.0,67818.0,2018,6,1
INDUSTRIAL GRAPHICS SUPERVISOR 1490 052518.txt,INDUSTRIAL GRAPHICS SUPERVISOR,1490,1,,"An Industrial Graphics Supervisor plans, organizes and directs the work of employees of a graphics unit engaged in providing printing, duplicating, reprographic, stationery forms supply, photocopier support and related services for the Department of Water and Power; or assigns, reviews, and evaluates the work of employees engaged in printing, duplicating and reprographic services; applies sound supervisory principles and techniques in building and maintaining an effective work force.",,,,Two years,full-time,,,"supervising reproduction or print shop activities as a Reprographics Supervisor, Printing Services Supervisor, or in a class which is at that level with the City of Los Angeles;",,R,,OPEN_INT_PROM,"$102,458","$108,179",,"1. Two years of full-time paid experience supervising reproduction or print shop activities as a Reprographics Supervisor, Printing Services Supervisor, or in a class which is at that level with the City of Los Angeles; or
2. Four years of full-time paid experience as a Senior Duplicating Machine Operator with the City of Los Angeles supervising employees engaged in reproduction or print shop activities, or in a class which is at that level with the City of Los Angeles; or
3. Four years of full-time paid experience supervising employees engaged in a variety of photo reproduction or print shop activities, including the operation of: offset duplicating machines; electrostatic copier/duplicators; microfilm, photo reproduction, or diazo machines; or bindery equipment.","THURSDAYJUNE 7, 2018",05-25-18,102458.0,108179.0,2018,5,2
TRAFFIC MARKING AND SIGN SUPERINTENDENT 3430 032219.txt,TRAFFIC MARKING AND SIGN SUPERINTENDENT,3430,,,"A Traffic Marking and Sign Superintendent assigns, reviews, evaluates, plans, organizes and directs the work of employees in the Field Operations and Maintenance Division in the Department of Transportation, engaged in painting, plasticizing, maintaining, installing, or removing traffic and parking control markings on streets and curbs or installing, maintaining, or removing traffic and parking control signs; applies sound supervisory principles and techniques in building and maintaining an effective work force; fulfills equal employment opportunity responsibilities; and does related work.",,,,Two years,full-time,Traffic Painter,,"with the City of Los Angeles as a Traffic Painter and Sign Poster or in a class which is at that level and provides experience in the installation, maintenance, removal, or manufacture of traffic markings, signs, or parking control devices",,R,,INT_DEPT_PROM,"$56,835","$83,144",,"Two years of full-time paid experience with the City of Los Angeles as a Traffic Painter and Sign Poster or in a class which is at that level and provides experience in the installation, maintenance, removal, or manufacture of traffic markings, signs, or parking control devices.","THURSDAYAPRIL 4, 2019",03-22-19,56835.0,83144.0,2019,3,2
FIREBOAT PILOT 5127 102315 rev110515 (1).txt,FIREBOAT PILOT,5127,1,,A Fireboat Pilot operates and directs the navigation of a large fireboat in Los Angeles; and does related work.,,college,,five years,full-time,,,"in the City of Los Angeles Fire Department by June 12, 2016.  Under the policy of rounding experience to the nearest full month, continuous service beginning on or before June 26, 2011, meets the requirement;",15 semester or 24 quarter units,,,T_PROM,"$109,974","$122,586",,"1. Completion of ""Basic Underway Verification"" process, as documented upon the City of Los Angeles Fire Department (LAFD) BUV form and within member's PRB, required at time of written test; and
2.	Completion of five years of full-time paid fire suppression certified experience in the City of Los Angeles Fire Department by June 12, 2016.  Under the policy of rounding experience to the nearest full month, continuous service beginning on or before June 26, 2011, meets the requirement; or
3.	Any combination of Fireboat Mate and fire suppression certified experience equating to five years.

Completion of 15 semester or 24 quarter units in Fire Science/Fire Protection Administration at an accredited college or university may be substituted for a maximum of six months of the required experience as stated in Requirement #2.","THURSDAYNOVEMBER 12, 2015",10-23-15,109974.0,122586.0,2015,10,5
CHIEF SECURITY OFFICER 3187 092818.txt,CHIEF SECURITY OFFICER,3187,1,,"A Chief Security Officer organizes and directs the work of a large group of Principal Security Officers, Senior Security Officers, Security Officers, and Security Aides, engaged in patrolling and safeguarding City-owned buildings and their occupants, grounds, and equipment, and in crowd control; supervises the investigation of accidents, thefts, and disturbances; applies sound principles and techniques in building and maintaining an effective workforce; and fulfills Equal Employment Opportunity responsibilities; and does related work.",,,,One year,full-time,,,as a Principal Security Officer with the City of Los Angeles;,,R,,INT_DEPT_PROM,"$55,227","$80,763","$81,724 to $101,518","1. One year of full-time paid experience as a Principal Security Officer with the City of Los Angeles; or
2. Two years of full-time paid experience as a Senior Security Officer with the City of Los Angeles.","THURSDAYOCTOBER 11, 2018",09-28-18,55227.0,80763.0,2018,9,1
BUILDING REPAIR SUPERVISOR 3338 111816.txt,BUILDING REPAIR SUPERVISOR,3338,,,"A Building Repair Supervisor assigns, reviews and evaluates the work of craft workers and other employees engaged in the maintenance, repair, and nonstructural alteration of buildings, grounds, and appurtenant equipment; applies sound supervisory principles and techniques in building and maintaining an effective work force; and fulfills equal employment opportunity responsibilities.",,,,Four years,full-time,Building Repairer,,with the City of Los Angeles as a Building Repairer or in a class at that level which provides experience in building maintenance and repair work,,R,,INT_DEPT_PROM,"$84,585","$102,291","$82,977 to $103,105",Four years of full-time paid experience with the City of Los Angeles as a Building Repairer or in a class at that level which provides experience in building maintenance and repair work.,"THURSDAYDECEMBER 1, 2016",11-18-16,84585.0,102291.0,2016,11,4
ARCHITECTURAL ASSOCIATE 7926 013114 REV 032916.txt,CAMPUS INTERVIEWS ONLY,7926,,,"An Architectural Associate performs routine and moderately difficult professional architectural work in preparing and checking designs, plans, specifications, estimates, and reports; may prepare designs and drawings using Auto-CADD REVIT applications and prepares physical and digital models; coordinates the preparation of plans and specifications with private and public agencies; administers contracts; and may serve as a lead worker for other employees engaged in this work.",,,,,,,,,,P,,OPEN,"$64,916","$92,394","$77,360 to $96,110",,,01-31-14,64916.0,92394.0,2014,1,0
ELECTRICAL MECHANIC 3841 012017.txt,ELECTRICAL MECHANIC,3841,1,,"An Electrical Mechanic performs skilled mechanical and electrical work in the installation and maintenance of high and low voltage electrical circuits and related equipment at electrical stations and plants such as electrical substations; receiving, distributing, and customer stations; steam generating stations; water pumping and chlorinating stations; converter stations; hydro-electric plants; high voltage switching stations; and similar facilities and buildings; and performs other related duties.

Electrical Mechanics may work at heights of up to 280 feet, near hazardous materials, and in confined spaces.",,College,,Six months,full-time,,,performing electrical work on equipment and circuits in the maintenance or construction of electrical systems;,,R,,OPEN,"$69,655","$99,514",,"1. Six months of full-time paid experience performing electrical work on equipment and circuits in the maintenance or construction of electrical systems; or  
2. Six months, within the last two years, of full-time paid experience as an exempt Construction Electrical Mechanic or Construction Electrical Helper with the City of Los Angeles Department of Water and Power performing electrical work on equipment and circuits in the maintenance or construction of electrical systems; or
3. Completion of at least eight months in the Utility Pre-Craft Trainee training program sponsored by the Los Angeles Department of Water and Power, assisting in the performance of electrical work on high and low voltage equipment and circuits in the maintenance or construction of electrical systems; or
4. Six months of full-time experience performing electrical work on equipment and circuits in the maintenance or construction of electrical systems while in the United States Armed Forces; or
5. Certificate of completion of the Electrical Construction & Maintenance (ECM) program at Los Angeles Trade Technical College; or 
6. Certificate of completion of the Hayden Course sponsored by the Department of Water and Power; or
7. Certificate of completion of an electrical lineworker program from an accredited college.","MONDAYFEBRUARY 6, 2017 to 11:59 PM, FRIDAY, FEBRUARY 10, 2017",01-20-17,69655.0,99514.0,2017,1,0.5
STAFF ASSISTANT TO GENERAL MANAGER WATER AND POWER 9185 032715.txt,STAFF ASSISTANT TO GENERAL MANAGER WATER AND POWER,9185,,,"A Staff Assistant to General Manager Water and Power reviews and analyzes Department expenditure programs, rates revenues, and costs; makes recommendations on the development of financial and budgetary planning and policies; advises management on financial and budgetary and personnel matters; may plan, organize and direct the work of staff engaged in such activities; and does related work.",,,,,,,,,,R,,OPEN_INT_PROM,"$144,218","$179,171",,,"THURSDAYAPRIL 09, 2015",03-27-15,144218.0,179171.0,2015,3,0
CHIEF INSPECTOR 4254 082517.txt,CHIEF INSPECTOR,4254,1,,"A Chief Inspector plans, organizes, and directs the operation of a Division in the Department of Building and Safety or Housing, involved in construction inspection or code enforcement functions for new and existing commercial, industrial and residential buildings, their additions, appendages, accessory structures, and sites, including land use.  The purpose of these Divisions is to ensure that construction, alteration and maintenance of the above structures and sites conform to the full range of applicable codes, ordinances, laws, specifications, standards, approved building plans and grading and zoning ordinances.  These activities cover all types and stages of construction and maintenance for projects involving the inspection of building, electrical, plumbing, heating, ventilating, air conditioning, elevators, pressure vessels, and accessibility or grading.  A Chief Inspector uses sound managerial and supervisory principles and techniques to build and maintain an effective workforce; oversees the training of subordinate inspectors; carries out responsible high-level staff functions as assigned, and fulfills equal employment opportunity responsibilities.",,,,Two years,full-time,Principal Inspector,Senior Building,with the City of Los Angeles as a Principal Inspector;,,R,,INT_DEPT_PROM,"$106,050","$150,879",,"1. Two years of full-time paid experience with the City of Los Angeles as a Principal Inspector; or
2. Four years of full-time paid experience with the City of Los Angeles as a Senior Building Inspector, Senior Building Mechanical Inspector, Senior Electrical Inspector, Senior Heating and Refrigeration Inspector, Senior Plumbing Inspector, Senior Safety Engineer Elevators, Senior Fire Sprinkler Inspector, Senior Safety Engineer Pressure Vessels, or Senior Housing Inspector.","THURSDAYSEPTEMBER 7, 2017",08-25-17,106050.0,150879.0,2017,8,2
STREET LIGHTING ELECTRICIAN  3811 022318.txt,STREET LIGHTING ELECTRICIAN,3811,1,,A Street Lighting Electrician acts as a lead for and works with a crew of workers engaged in the construction and repair of electrolier street lighting systems.,,,,Two years,full-time,,,"as an Assistant Street Lighting Electrician, Line Maintenance Assistant, or in a position which is at that level which provides experience in constructing electrolier street lighting systems and repair and maintenance of high and low voltage street lighting circuitry",,,,INT_DEPT_PROM,"$90,645",flat-rated,,"1. A valid California B driver's license or higher and valid medical certificate approved by the State of California Department of Motor Vehicles; and
2. Two years of full-time paid experience as an Assistant Street Lighting Electrician, Line Maintenance Assistant, or in a position which is at that level which provides experience in constructing electrolier street lighting systems and repair and maintenance of high and low voltage street lighting circuitry.","THURSDAYMARCH 8, 2018",02-23-18,90645.0,90645.0,2018,2,2
PROPERTY OFFICER 3207 071417 (1).txt,PROPERTY OFFICER,3207,,,A Property Officer is an unarmed civilian employee of the Police Department who accepts and maintains physical accountability and detailed documentation for booked evidence and non-evidence property from time of booking to ultimate release or disposal; utilizes both computer based and physical data tracking and filing systems; and provides customer service to police officers and the general public.,,,,One year,full-time,,,"in warehouse or storekeeping work which includes experience in receiving, storing, issuing, and accounting for materials, supplies, parts, tools, or equipment",,R,,OPEN_INT_PROM,"$45,310","$64,457",,"One year of full-time paid experience in warehouse or storekeeping work which includes experience in receiving, storing, issuing, and accounting for materials, supplies, parts, tools, or equipment.","SATURDAYSEPTEMBER 9, 2017; SATURDAY, MARCH 10, 2018, AND SATURDAY, SEPTEMBER 8, 2018",07-14-17,45310.0,64457.0,2017,7,1
AQUARIST 2400 050214.txt,AQUARIST,2400,1,,An Aquarist procures and maintains a variety of live seawater animals and plant life in aquaria; and maintains the electrical and mechanical components of large seawater systems.,four-year,college,a biological science,,,,,or the equivalent as an aquarist in the collection and care of live seawater specimens and the maintenance of a large seawater system,,,,OPEN,"$55,624","$69,133",,"1. Graduation from a recognized four-year college or university with a major in a biological science; and
2. Eighteen (18) months of full-time paid experience or the equivalent as an aquarist in the collection and care of live seawater specimens and the maintenance of a large seawater system.","THURSDAYMAY 15, 2014",05-02-14,55624.0,69133.0,2014,5,0
AIRPORTS MAINTENANCE SUPERINTENDENT 3331 021518.txt,AIRPORTS MAINTENANCE SUPERINTENDENT,3331,1,,"An Airports Maintenance Superintendent plans, organizes, and directs, through subordinate supervisors, the work of several crews of skilled craft and maintenance workers engaged in the operation, custodial care, maintenance, alteration, repair, and construction of airports buildings, grounds, airfields, and appurtenant equipment, including complex air-conditioning equipment; applies sound supervisory techniques in building and maintaining an effective work force and fulfills equal employment opportunity responsibilities.",,,,Two years,full-time,,,"as an Airports Maintenance Supervisor, or in a class which is at that level, supervising employees engaged in building equipment maintenance and operation, equipment operation, fleet maintenance, fleet equipment procurement, construction, or street maintenance;",,P,,INT_DEPT_PROM,"$90,369","$132,108",,"1. Two years of full-time paid experience as an Airports Maintenance Supervisor, or in a class which is at that level, supervising employees engaged in building equipment maintenance and operation, equipment operation, fleet maintenance, fleet equipment procurement, construction, or street maintenance; or
2. Four years of full-time paid experience as a Senior Building Operating Engineer, or in a class which is at that level, as a working supervisor of employees engaged in building equipment maintenance and operation, equipment operation, fleet maintenance, fleet equipment procurement, construction, or street maintenance.","THURSDAYMARCH 1, 2018",02-16-18,90369.0,132108.0,2018,2,2
MANAGEMENT AIDE 1508 033117.txt,MANAGEMENT AIDE,1508,1,,"A Management Aide performs paraprofessional duties in assisting professional, technical, administrative, or personnel staff in the preparation of correspondence, reports, studies, and surveys on a wide variety of administrative, fiscal, budgetary, personnel, and management problems.",,,,Three years,full-time,Customer Service,,with the City of Los Angeles in a class at the level of Senior Administrative Clerk;,,P,,INT_DEPT_PROM,"$47,732","$69,760","$57,774 to $71,785","1.	Three years of full-time paid office clerical experience with the City of Los Angeles in a class at the level of Senior Administrative Clerk; or
2.	Four years of full-time paid experience with the City of Los Angeles as a Customer Service Representative.","THURSDAYAPRIL 13, 2017",03-31-17,47732.0,69760.0,2017,3,3
PLUMBING INSPECTOR 4231 042817 REV 051117.txt,PLUMBING INSPECTOR,4231,1,,A Plumbing Inspector inspects plumbing installations for conformance to the provisions of pertinent laws and/or construction specifications and assists in training other employees as required.,,apprentice,both residential and commercial plumbing installations,Four years,full-time,,,as a plumbing inspector with work in both residential and commercial plumbing installations;,,R,,OPEN_INT_PROM,"$78,696","$95,171",,"1. Four years of full-time paid experience as a plumbing inspector with work in both residential and commercial plumbing installations; or
2. Successful completion of a recognized plumbing apprenticeship program and four years of full-time paid experience with work in both residential and commercial plumbing installations; or
3. Nine years of full-time paid plumbing experience with work in both residential and commercial plumbing installations.","THURSDAYMAY 18, 2017",04-28-17,78696.0,95171.0,2017,4,4
AIRPORT POLICE CAPTAIN 3228 021618.txt,AIRPORT POLICE CAPTAIN,3228,,,"An Airport Police Captain plans, supervises, directs and controls civilian and sworn Airport Police Division employees within a division, section or large tactical group; applies sound management techniques to ensure the mission of the Airport Police Division is met through enforcement of federal, state and local laws and regulations, City of Los Angeles ordinances, Airport Security Program requirements and airport rules and regulations at any one of the airports of the City of Los Angeles; and does other related work.",,,,One year,full-time,,,"as an Airport Police Lieutenant with the Los Angeles World Airports, or in a class at that level, with responsibility for all law enforcement and safety and security services provided at a LAWA facility during a watch or by a particular unit",,R,,T_PROM,"$142,568","$187,001",,"One year of full-time paid experience as an Airport Police Lieutenant with the Los Angeles World Airports, or in a class at that level, with responsibility for all law enforcement and safety and security services provided at a LAWA facility during a watch or by a particular unit.","THURSDAYMARCH 1, 2018",02-16-18,142568.0,187001.0,2018,2,1
PAINTER SUPERVISOR 3426 120514.txt,PAINTER SUPERVISOR,3426,,,"A Painter Supervisor assigns, reviews and evaluates the work of Senior Painters, Painters and other employees engaged in preparing surfaces, lead abatement and mixing, matching, and applying paint and related material by brush, roller or spray gun to machinery, equipment, piping systems, furniture, and the interior and exterior of buildings and other structures, and schedules and estimates painting costs; applies sound supervisory principles and techniques in building and maintaining an effective work force; and fulfills equal employment opportunity responsibilities.",,,,,,,,,,P,,INT_DEPT_PROM,"$83,645",flat-rated,"$93,396 to $98,595",,"THURSDAYDECEMBER 18, 2014",12-05-14,83645.0,83645.0,2014,12,0
