FILE_NAME,JOB_CLASS_TITLE,JOB_CLASS_NO,REQUIREMENT_SET_ID,REQUIREMENT_SUBSET_ID,JOB_DUTIES,EDUCATION_YEARS,SCHOOL_TYPE,EDUCATION_MAJOR,EXPERIENCE_LENGTH,FULL_TIME_PART_TIME,EXP_JOB_CLASS_TITLE,EXP_JOB_CLASS_ALT_RESP,EXP_JOB_CLASS_FUNCTION,COURSE_LENGTH,DRIVERS_LICENSE_REQ,DRIV_LIC_TYPE,EXAM_TYPE,SALARY_START,SALARY_END,ENTRY_SALARY_DWP,REQUIREMENTS,APPLICATION_DEADLINE,OPEN_DATE,SALARY_START_NUM,SALARY_END_NUM,OPEN_YEAR,OPEN_MONTH,EXP_NUM
ARTS ASSOCIATE 2454 072117 REV 072817.txt,ARTS ASSOCIATE,2454,1,,"An Arts Associate performs a broad range of entry-level professional arts administration work in the areas of: community and public arts program coordination; cultural grant administration; performing arts and festival production; preparation and development of marketing materials; project management in public art, mural commissioning, and conservation of artworks; and art collection management and/or archives, while receiving on-the-job training and experience in preparation for career advancement in various art administration areas.",four-year,college,"Arts (design, literary, media/communication, performing, and/or visual), Cultural Studies, Literature, English, Art History, Art Administration, or a closely related field",two years,full-time,,,"within the last ten years in assisting and coordinating a program in an organization responsible for fine arts, public art, or cultural programs and activities;",9 semester units or 14 quarter units,P,,OPEN,"$48,797","$71,326",,"1. A bachelor's degree from an accredited four-year college or university with a major in Arts (design, literary, media/communication, performing, and/or visual), Cultural Studies, Literature, English, Art History, Art Administration, or a closely related field; or
2. An associate of arts degree from an accredited two-year college with a major in Arts (design, literary, media/communication, performing, and/or visual), Cultural Studies, Literature, English, Art History, Art Administration, or a closely related field, including completion of 9 semester units or 14 quarter units in the fields listed; and two years of full-time paid experience within the last ten years in assisting and coordinating a program in an organization responsible for fine arts, public art, or cultural programs and activities; or
3. Four years of full-time paid experience within the last ten years in assisting and coordinating a program in an organization responsible for fine arts, public art, or cultural programs and activities.","THURSDAYAUGUST 3, 2017",07-21-17,48797.0,71326.0,2017,7,2
SENIOR COMMUNICATIONS ELECTRICIAN 3638 030317 (1).txt,SENIOR COMMUNICATIONS ELECTRICIAN,3638,,,"A Senior Communications Electrician acts as a lead for and works with a small group of employees engaged in the construction, installation, repair, maintenance, and modification of communication systems and equipment such as: radio, microwave transmission, Local Area Network/Wide Area Network data distribution systems, telephone networks, audio, avionic electronics, intrusion alarm systems, mobile digital terminals, dispatch networks, copper and fiber-optic cable systems, video distribution systems, supervisory control and data acquisition (scada), and transmission systems.",,,,Two years,full-time,,,"in a class at least at the level of Communications Electrician engaged in the construction, installation, operation, repair, maintenance, or modification of electronic communication systems",,P,,INT_DEPT_PROM,"$94,941",flat-rated,"$114,568","Two years of full-time paid experience in a class at least at the level of Communications Electrician engaged in the construction, installation, operation, repair, maintenance, or modification of electronic communication systems.","THURSDAYMARCH 16, 2017",03-03-17,94941.0,94941.0,2017,3,2
SENIOR AUTOMOTIVE SUPERVISOR 3716 112015.txt,SENIOR AUTOMOTIVE SUPERVISOR,3716,,,"A Senior Automotive Supervisor assists in planning, organizing, directing, and coordinating the work of employees engaged in the maintenance and repair of transportation, construction, and fire equipment; and assists in developing and writing specifications, analyzing bids, and recommending the purchase of new equipment and modifications; applies sound supervisory principles and techniques in building and maintaining an effective work force; and fulfills Equal Employment Opportunity responsibilities.",,,,Two years,full-time,,,with the City of Los Angeles as an Automotive Supervisor or in a class at that level supervising employees engaged in the maintenance and repair of transportation or construction equipment,,,C,INT_DEPT_PROM,"$103,126","$111,875",,Two years of full-time paid experience with the City of Los Angeles as an Automotive Supervisor or in a class at that level supervising employees engaged in the maintenance and repair of transportation or construction equipment.,"THURSDAYDECEMBER 3, 2015",11-20-15,103126.0,111875.0,2015,11,2
WASTEWATER COLLECTION WORKER 4110 102612 REV 092817.txt,WASTEWATER COLLECTION WORKER,4110,1,,A Wastewater Collection Worker performs a variety of semi-skilled and skilled tasks in the maintenance and repair of sanitary sewers and storm drains; operates highly specialized sewer and storm drain cleaning equipment; utilizes laptop computers to complete work assignments; performs research on wastewater collection assets; and may act as a working field supervisor over a small group of employees.,,,,One year,full-time,,,"with the City of Los Angeles Department of Public Works, Bureau of Sanitation, Wastewater Collection Systems Division, as a Maintenance Laborer, Maintenance and Construction Helper, or Mechanical Helper;",,R,,OPEN_INT_PROM,"$43,973","$62,556",,"1. One year of full-time paid experience with the City of Los Angeles Department of Public Works, Bureau of Sanitation, Wastewater Collection Systems Division, as a Maintenance Laborer, Maintenance and Construction Helper, or Mechanical Helper; or
2. One year of full-time paid experience in the maintenance, repair or construction of municipal sanitary sewers or storm drain systems.",,10-26-12,43973.0,62556.0,2012,10,1
SENIOR STOREKEEPER 1837 052518.txt,SENIOR STOREKEEPER,1837,,,"A Senior Storekeeper assigns, reviews and evaluates the work of Storekeepers and other employees engaged in storekeeping activities in a district store, a construction project store, or a large independent or specialized section of a general store; directs a smaller store serving a single large City department; may act as the assistant to a Principal Storekeeper; applies sound supervisory principles and techniques in building and maintaining an effective work force, and fulfills Equal Employment Opportunity responsibilities.",,,,Two years,full-time,,,as a Storekeeper or in a class at least at that level supervising and working with employees engaged in storekeeping,,P,,INT_DEPT_PROM,"$52,806","$77,172","$83,373 to $88,030",Two years of full-time paid experience as a Storekeeper or in a class at least at that level supervising and working with employees engaged in storekeeping.,"THURSDAYJUNE 7, 2018",05-25-18,52806.0,77172.0,2018,5,2
ASSISTANT TREE SURGEON 3150 012017.txt,ASSISTANT TREE SURGEON,3150,1,,An Assistant Tree Surgeon assists in tree trimming and removal work and performs a variety of unskilled tasks on the ground.,,,,,,,,,,,,OPEN,"$35,746","$52,241",,"1. Current employment as a Vocational Worker with the City of Los Angeles assigned to a position that assists in tree trimming and/or removal work; and
2. A letter of recommendation from the personnel office of the employing department, which includes a statement of the department's willingness to hire the employee as an Assistant Tree Surgeon. The letter must be attached to the application at the time of filing.",,01-20-17,35746.0,52241.0,2017,1,0
PIPEFITTER 3433 080318.txt,PIPEFITTER,3433,1,,"A Pipefitter does skilled work in the installation, replacement, maintenance, and repair of industrial steam, oil, air, gas, water, steam heating and other pipe systems, including high pressure and high temperature systems.",,apprentice,pipefitter,Five years,full-time,,,as a Mechanical Helper with the City of Los Angeles working with a Pipefitter;,,P,,OPEN_INT_PROM,"$94,455",flat-rated,"$101,622","1. Completion of a recognized apprenticeship as a pipefitter; or
2. Five years of full-time paid experience as a Mechanical Helper with the City of Los Angeles working with a Pipefitter; or
3. Six years of full-time paid experience performing installation, replacement, maintenance and repair of industrial steam, oil, air, gas, water, steam heating and other pipe systems, including high pressure and high temperature systems.","THURSDAYAUGUST 16, 2018",08-03-18,94455.0,94455.0,2018,8,5
MECHANICAL REPAIRER 3773 092118.txt,MECHANICAL REPAIRER,3773,,,A Mechanical Repairer does a variety of tasks in maintaining and repairing mechanical equipment and tools.,,,,Two years,full-time,,,at the helper level performing mechanical repair work,,,B,INT_DEPT_PROM,"$82,000",flat-rated,"$82,204","Two years of full-time paid experience at the helper level performing mechanical repair work.

Completion of the Los Angeles Trade Tech Air-Cooled Engine curriculum may be substituted for a maximum of one year of the required experience.","THURSDAYOCTOBER 4, 2018",09-21-18,82000.0,82000.0,2018,9,2
SENIOR DETENTION OFFICER 3212 012017.txt,SENIOR DETENTION OFFICER,3212,,,"A Senior Detention Officer works with and assigns, reviews and evaluates the work of Detention Officers and other assigned personnel engaged in booking, processing, and releasing of arrested persons and their personal property; maintains custody and control of prisoners; applies sound supervisory principles and techniques in building and maintaining an effective work force; fulfills equal employment opportunity responsibilities; conducts administrative investigations involving subordinate staff; and does related work.",,,,Two years,full-time,,,as a Detention Officer with the City of Los Angeles,,P,,INT_DEPT_PROM,"$51,699","$73,560",,Two years of full-time paid experience as a Detention Officer with the City of Los Angeles.,"THURSDAYFEBRUARY 2, 2017",01-20-17,51699.0,73560.0,2017,1,2
BUILDING REPAIRER 3333 030218.txt,BUILDING REPAIRER,3333,,,"A Building Repairer does a variety of maintenance, modification and repair and some new construction work on buildings, residences, sports fields, bleachers, signs, fences, and other structures and maintains and repairs equipment used in such structures and performs related work.",,,,Three years,full-time,,,"in one or more of the following building trades: carpentry, plumbing, roofing, plastering, cabinet making, painting, masonry, cement finishing, electrical, and/or pipefitting",,P,A,OPEN_INT_PROM,"$44,411","$64,915","$70,845 to $88,030","Three years of full-time paid experience in one or more of the following building trades: carpentry, plumbing, roofing, plastering, cabinet making, painting, masonry, cement finishing, electrical, and/or pipefitting.","THURSDAYMARCH 15, 2018",03-02-18,44411.0,64915.0,2018,3,3
SENIOR ANIMAL KEEPER 4305 022616.txt,SENIOR ANIMAL KEEPER,4305,,,"A Senior Animal Keeper assigns, reviews and evaluates the work of employees engaged in caring for exotic mammals, birds, venomous and non-venomous reptiles, and amphibians at the Los Angeles Zoo; performs the more difficult and responsible work in caring for animals; maintains the exhibit premises in a clean and aesthetically pleasing manner; applies sound supervisory principles and techniques in building and maintaining an effective work force; and fulfills equal employment opportunity responsibilities.",,,,,,,,,,R,,INT_DEPT_PROM,"$48,964","$69,656",,,"THURSDAYMARCH 10, 2016",02-26-16,48964.0,69656.0,2016,2,0
AIRPORT GUIDE 0845 042018.txt,AIRPORT GUIDE,0845,,,An Airport Guide directs arriving passengers to appropriate lines or locations in and around airport facilities; assists passengers in the completion of necessary paperwork; assists with foreign language translations; provides a wide range of airport/airline information to passengers; transports elected officials to various locations on airport property; conducts visitor tours; organizes and hosts special events; serves as museum docent; represents LAWA to the public; assists responding agencies during airport emergencies; may plan and supervise the work of other Airport Guides; and does related work.,,high school,,,,,,"in a position providing customer service at an airport or other transportation-related venues such as bus terminals, train stations, and port facilities for at least 12 consecutive months",,P,,OPEN,"$31,946","$44,265",,"1,040 hours of paid or volunteer experience in a position providing customer service at an airport or other transportation-related venues such as bus terminals, train stations, and port facilities for at least 12 consecutive months.

A high school diploma is desired.","THURSDAYMAY 3, 2018",,31946.0,44265.0,,,0
LAND SURVEYING ASSISTANT 7283 120817.txt,LAND SURVEYING ASSISTANT,7283,1,,"A Land Surveying Assistant sets up and operates total stations, levels, theodolites, electronic distance measuring devices, Global Positioning System (GPS) equipment, data collectors, hydrographic equipment, and other survey instruments to secure data pertaining to lines, corners, elevations, grades, curves, alignments, positions, and water depths; makes field notes, sketches, and computer maps; performs computations, processes data; and may act as a Survey Party Chief when needed.",,college,member of a field survey party or field crew,one year,full-time,,,as a member of a field survey party or field crew;,,P,,OPEN_INT_PROM,"$66,440","$97,133","$85,858 to $106,675","1. Graduation from an accredited college or university with a degree in engineering or surveying and one year of full-time paid experience as a member of a field survey party or field crew; or
2. Four years of full-time paid experience as a Field Engineering Aide, or as a member of a field survey party performing sub-professional land surveying work in making precise readings, measurements, and tests in the field.","THURSDAYDECEMBER 21, 2017",12-08-17,66440.0,97133.0,2017,12,1
TRAFFIC OFFICER 3214 040116.txt,TRAFFIC OFFICER,3214,,,"A Traffic Officer patrols an assigned area on foot, bicycle, or in a vehicle to enforce motor vehicle parking regulations; issues warnings or citations for illegal parking by entering information into a hand-held computer; impounds vehicles; and directs vehicular and pedestrian traffic at a specific intersection or other specified location.

Traffic Officers at the highest pay grade will be expected to direct vehicular and pedestrian traffic on a daily basis at various assigned locations. They may provide the initial field training to new Traffic Officers on a temporary short-term basis, and may serve as acting, on-site supervisors on a temporary short-term basis.

Traffic Officers may be assigned to work any work shift, including weekends and holidays, and may be assigned to work in any geographic location in the City of Los Angeles. Work must be performed outdoors in all weather conditions. Work shifts may also be extended in emergency situations.",,,,,,,,,,R,,OPEN,"$45,017","$48,838",,,"TUESDAYAPRIL 12, 2016, UNTIL THURSDAY, APRIL 14, 2016, AT 11:59",04-01-16,45017.0,48838.0,2016,4,0
BLACKSMITH 3733 082517 REV 090717.txt,BLACKSMITH,3733,1,,"A blacksmith forges, shapes, forms, bends, cuts, grinds, welds, tempers, and heat-treats metals in the fabrication and repair of tools, equipment, and metal products.",,apprentice,blacksmith,Five years,full-time,,,as a helper to a blacksmith,,R,,OPEN_INT_PROM,"$83,352",flat-rated,"$76,608 to $95,191","1. Completion of an apprenticeship as a blacksmith; or
2. Attainment of journey-level rank as a blacksmith; or
3. Five years of full-time paid experience as a helper to a blacksmith.","THURSDAYSEPTEMBER 14, 2017",08-25-17,83352.0,83352.0,2017,8,5
SAFETY ENGINEERING ASSOCIATE 1726 052518.txt,SAFETY ENGINEERING ASSOCIATE,1726,1,,A Safety Engineering Associate assists in administering a program for employee safety and accident prevention for a City department or several departments.,four-year,college,"occupational health science, health and safety studies or a closely related field",one year,full-time,,,"in the enforcement of Federal OSHA, CAL/OSHA or any state OSHA regulations which includes facility or field inspections and the development of safety programs",,R,,OPEN,"$74,623","$90,222","$92,978 to $115,508","1. Graduation from an accredited four-year college or university with a Bachelor's Degree or Master's Degree in occupational health science, health and safety studies or a closely related field; or
2. Graduation from an accredited four-year college or university and one year of full-time paid professional safety experience in the enforcement of Federal OSHA, CAL/OSHA or any state OSHA regulations which includes facility or field inspections and the development of safety programs.","THURSDAYJUNE 7, 2018",05-25-18,74623.0,90222.0,2018,5,1
ELECTRICAL TESTER 7512 102816.txt,ELECTRICAL TESTER,7512,1,,"An entry-level Electrical Tester receives intensive classroom and on-the-job instruction and training. The trainee is supervised by a Senior Electrical Tester and works as a trainee assisting journey-level electrical workers within the Testing Laboratories in the performance of diagnostic tests, calibration, repair, maintenance, and adjustments on: high and low voltage electrical circuits, equipment and related material; meters, smart-grid systems, conventional and renewable generation resources, control circuits, instruments, relays and related equipment and materials; new locations; and performs related duties. A journey-level Electrical Tester: performs routine calibration tests of meters; makes routine electrical tests of material; assists in testing more complex electric instruments and equipment; tests and replaces electric meters, control and protective relays, instruments, transformers, and other equipment and materials; performs cathodic protection in underground and abovehead structures; performs infrared inspection of high voltage overhead distribution systems; and builds and test circuit boards, removes or replaces components, and tests communication levels, in regard to facility/substation Supervisory Control and Data Acquisition (SCADA) systems, Remote Terminal Units (RTU), and other control systems. Journey-level Electrical Testers may also: lead a group of employees engaged in field or laboratory electrical testing; perform the more difficult and advanced functions of electrical testing; and perform related duties.",,college,"physics, chemistry, electricity, or electronics",Six months,full-time,,,"and current employment as a helper or trainee for a utility performing work on equipment and circuits, construction and maintenance;",,R,,OPEN,"$54,079","$67,170",,"1. Six months of full-time paid experience and current employment as a helper or trainee for a utility performing work on equipment and circuits, construction and maintenance; or
2.	Completion of eight months in the Utility Pre-Craft Trainee training program sponsored by the Los Angeles Department of Water and Power; or
3.	Successful completion of three semester units or four quarter units from an accredited college or university or trade school in physics, chemistry, electricity, or electronics; or 
4.	Successful completion of the Pre-Electrical Craft Helper training course presented by the Los Angeles Trade Technical College; or
5.	Six months of full-time experience performing electrical work on equipment and circuits in the maintenance or construction of electrical systems while in the United States Armed Forces.","SUNDAYJANUARY 8, 2017",10-28-16,54079.0,67170.0,2016,10,0.5
FIRE PROTECTION ENGINEERING ASSOCIATE 7978 041318.txt,FIRE PROTECTION ENGINEERING ASSOCIATE,7978,1,,"A Fire Protection Engineering Associate performs professional engineering work in the application of engineering principles to problems of safeguarding life and property against loss from fire, explosions and related hazards; applies state and local regulations to guard against hazardous material and toxic chemical releases; conducts fire and life safety reviews of building plans and field inspections for new construction projects.",four-year,college,engineering,,,,,,,P,,OPEN,"$66,231","$96,841",,"1. Graduation from an accredited four-year college or university with a degree in engineering; or
2. Certification as an Engineer-In-Training recognized by the State of California Board for Professional Engineers, Land Surveyors, and Geologists.","THURSDAYAPRIL 26, 2018",04-13-18,66231.0,96841.0,2018,4,0
LABOR SUPERVISOR 3126 121815.txt,LABOR SUPERVISOR,3126,,,"A Labor Supervisor assigns, reviews and evaluates the work of a labor crew that may consist of helpers, laborers, semiskilled workers and equipment operators, and other employees engaged in various construction, maintenance, and repair projects, and other related duties; applies sound supervisory principles and techniques in building and maintaining an effective work force; fulfills Equal Employment Opportunity responsibilities; and maintains written records as requested.",,,,,,,,,,P,,INT_DEPT_PROM,"$44,474","$65,020","$63,287 to $97,822",,"THURSDAYDECEMBER 31, 2015",12-18-15,44474.0,65020.0,2015,12,0
ARCHIVIST 1191 020918.txt,ARCHIVIST,1191,1,,"An Archivist performs professional archival work in appraising, analyzing, classifying, describing, preserving and providing reference service from historic documents and manuscripts; implements systems, standards and procedures for maintaining, retrieving, protecting and preserving historical records; prepares finding aids to make archival materials accessible to the public; and does related work.",four-year,college,,two years,full-time,,,"which include the responsibility for identifying, analyzing, classifying and indexing historical records for archival storage",30 semester or 45 quarter units,,,OPEN,"$57,273","$83,728",,"1. A bachelor's degree from an accredited four-year college or university, and two years of full-time paid archival experience which include the responsibility for identifying, analyzing, classifying and indexing historical records for archival storage.

Experience of the above type may be substituted for education lacking on a year for year basis up to a maximum of two years (NOTE: 30 semester or 45 quarter units = 1 year of education).","THURSDAYFEBRUARY 22, 2018",02-09-18,57273.0,83728.0,2018,2,2
DIRECTOR OF PORT CONSTRUCTION AND MAINTENANCE 3123 030416.txt,DIRECTOR OF PORT CONSTRUCTION AND MAINTENANCE,3123,,,"A Director of Port Construction and Maintenance plans, organizes and directs the work of a high-performing, professional, technical and trade-oriented staff engaged in maintenance, repair, construction and rehabilitation of marine-related facilities, equipment and infrastructure within the Port of Los Angeles, applies sound managerial principles and techniques in building and maintaining an effective work force; and fulfills equal employment opportunity responsibilities.",,,,,,,,,,R,,OPEN_INT_PROM,"$108,576","$154,512",,,"THURSDAYMARCH 17, 2016",03-04-16,108576.0,154512.0,2016,3,0
PROPERTY MANAGER 1964 090916 (1).txt,PROPERTY MANAGER,1964,1,,"A Property Manager plans and directs, or assists in planning and directing a comprehensive program of real property acquisition, sale, leasing, development (which may include pre-development and redevelopment), appraisal, and property management in a department.",,,,Two years,full-time,,,"in a class at the level of Senior Real Estate Officer with the City of Los Angeles performing duties in the appraisal, acquisition, sale, development (which may include pre-development and/or redevelopment duties), or management of commercial, industrial or watershed property; or managing tenant relationships, leasing activities and property management/maintenance, or developing and oversight of concessions;",,P,,OPEN_INT_PROM,"$95,088","$135,282","$112,543 to $139,833","1. Two years of full-time paid experience in a class at the level of Senior Real Estate Officer with the City of Los Angeles performing duties in the appraisal, acquisition, sale, development (which may include pre-development and/or redevelopment duties), or management of commercial, industrial or watershed property; or managing tenant relationships, leasing activities and property management/maintenance, or developing and oversight of concessions; or
2. Four years of full-time paid experience in a class at the level of Real Estate Officer with the City of Los Angeles performing duties in the appraisal, acquisition, sale, leasing, development (which may include pre-development and/or redevelopment duties), or management of commercial, industrial or watershed property; or managing tenant relationships, leasing activities and property management/maintenance, or developing and oversight of concessions; or
3. Five years of full-time paid experience performing duties in the appraisal, acquisition, sale, development (which may include pre-development and/or redevelopment duties), or management of commercial, industrial, or watershed property or managing tenant relationships, leasing activities and property management/maintenance, or developing and oversight of concessions. Two of the required five years of experience must be in a supervisory capacity managing a staff engaged in related activities.","THURSDAYSEPTEMBER 22, 2016",09-09-16,95088.0,135282.0,2016,9,2
