FILE_NAME,JOB_CLASS_TITLE,JOB_CLASS_NO,REQUIREMENT_SET_ID,REQUIREMENT_SUBSET_ID,JOB_DUTIES,EDUCATION_YEARS,SCHOOL_TYPE,EDUCATION_MAJOR,EXPERIENCE_LENGTH,FULL_TIME_PART_TIME,EXP_JOB_CLASS_TITLE,EXP_JOB_CLASS_ALT_RESP,EXP_JOB_CLASS_FUNCTION,COURSE_LENGTH,DRIVERS_LICENSE_REQ,DRIV_LIC_TYPE,EXAM_TYPE,SALARY_START,SALARY_END,ENTRY_SALARY_DWP,REQUIREMENTS,APPLICATION_DEADLINE,OPEN_DATE,SALARY_START_NUM,SALARY_END_NUM,OPEN_YEAR,OPEN_MONTH,EXP_NUM
ELECTRICAL CRAFT HELPER 3799 092818.txt,ELECTRICAL CRAFT HELPER,3799,1,a,An Electrical Craft Helper assists a skilled journey-level worker engaged in one of the electrical trades. Typical assignments involve the maintenance and construction of electrical systems for buildings and facilities; installation and maintenance of overhead or underground power distribution systems; or shop repair activities. Apprentice training opportunities leading to craft positions are available in some departments.,,College,,Six months,full-time,,,as a helper in an electrical trade;,,,A,OPEN,"$63,686",flat-rated,"$58,839 to $73,100","1. Six months of full-time paid experience as a helper in an electrical trade; or
2. Successful completion of one of the following:
a. Completion of at least eight months in the Utility Pre-Craft Trainee training program sponsored by the Department of Water and Power; or
b. Hayden Electricity Course sponsored by the Department of Water and Power; or
c. Pre-Electrical Craft Helper training course presented by Los Angeles Trade Technical College; or
d. The 120 hour Electrical Technician/Electric Utility Worker class presented by the Los Angeles Unified School District; or
e. The 600 hour Electrical Technician/Electrical Distribution Mechanic Trainee Program presented by the Los Angeles Unified School District; or
f. An accredited lineman college with a climbing certificate; or
3.   Six months of full time experience as a helper in performing electrical work on equipment and circuits in the maintenance or construction of electrical systems while in the United States Armed Forces.","SATURDAYDECEMBER 8, 2018",09-28-18,63686.0,63686.0,2018,9,0.5
MECHANICAL ENGINEERING ASSOCIATE 7554 061617.txt,MECHANICAL ENGINEERING ASSOCIATE,7554,1,,"A Mechanical Engineering Associate performs professional mechanical engineering work in the preparation of plans, designs, specifications, reports, estimates, recommendation of awards, studies, quality assurance programs, safety and health testing, and in research, testing and inspection activities related to the manufacturing, construction, installation, operation and maintenance of mechanical equipment and systems, or checking mechanical systems of buildings for code compliance and operation and maintenance feasibility; may perform code enforcement functions relating to design and specifications of plumbing, mechanical and elevator installations and related equipment approval; and does related work.",,college,,,,,,,24 semester units or 36 quarter units,P,,OPEN,"$66,231","$94,252","$78,905 to $98,031","1. A Bachelor's or Master's degree in engineering from an accredited college or university, which includes at least 24 semester units or 36 quarter units of core courses in mechanical engineering; or
2. Certification as an Engineer-In-Training recognized by the State of California Board for Professional Engineers, Land Surveyors, and Geologists; or
3. Registration as a Professional Engineer with the State of California Board for Professional Engineers, Land Surveyors, and Geologists.","THURSDAYJUNE 29, 2017",06-16-17,66231.0,94252.0,2017,6,0
PRINCIPAL INSPECTOR 4226 061617.txt,PRINCIPAL INSPECTOR,4226,,,"A Principal Inspector plans, organizes and directs the operation and activities of a section or assists in similar activities in a division involved in building, electrical, plumbing, grading, mechanical, elevator, or pressure vessel inspections and code enforcement or habitability inspection activities; applies sound supervisory principles and techniques in building and maintaining an effective workforce; and fulfills equal employment opportunity responsibilities.",,,,Two years,full-time,senior inspector,,"with the City of Los Angeles as a senior inspector in any of the following inspection disciplines:  Building, Building Mechanical, Electrical, Plumbing, Fire Sprinkler, Heating and Refrigeration, Housing, Elevators, or Pressure Vessels",,P,,INT_DEPT_PROM,"$86,380","$126,303",,"Two years of full-time paid experience with the City of Los Angeles as a senior inspector in any of the following inspection disciplines:  Building, Building Mechanical, Electrical, Plumbing, Fire Sprinkler, Heating and Refrigeration, Housing, Elevators, or Pressure Vessels.","THURSDAYJUNE 29, 2017",06-16-17,86380.0,126303.0,2017,6,2
ADVANCE PRACTICE PROVIDER CORRECTIONAL CARE 2325 020808 REV 111214.txt,ADVANCE PRACTICE PROVIDER CORRECTIONAL CARE,2325,1,a,"An Advance Practice Provider Correctional Care is responsible for obtaining medical histories, performing physical examinations, ordering and interpreting diagnostic tests, assessing medical conditions, providing medical care and treatment, and performing related duties as required under standardized procedures and/or protocols established by the department in one of the City's correctional care facilities.",,,,,,,,,,,,OPEN,"$78,487","$97,530",,"1. Must be licensed as a: 
a. Registered Nurse and certified as a Nurse Practitioner by the California Board of Registered Nursing with documentation of education and training as a Nurse Practitioner in family practice, adult, or emergency medicine, and possess a current license, Furnishing Number, and a Drug Enforcement Administration (DEA) registration number which provides the ability to provide drug/medication orders in the State of California; or
b. Physician Assistant with documentation of education and training as a Physician Assistant in family practice, adult, or emergency medicine, and possess a current license and a Drug Enforcement Administration (DEA) registration number which provides the ability to provide drug/medication orders in the State of California; and  
2. Must have a current, valid American Heart Association Healthcare Provider CPR card (Applicants must list the expiration date of their CPR card in the free-flowing text box on the application).",,02-08-08,78487.0,97530.0,2008,2,0
AQUEDUCT AND RESERVOIR KEEPER 5813 063017 (1).txt,AQUEDUCT AND RESERVOIR KEEPER,5813,1,,"An Aqueduct and Reservoir Keeper patrols and inspects a reservoir, a section of an aqueduct, or water shed to locate actual or potentially unsafe or unsanitary conditions; operates gates and valves as instructed to control the flow of water; monitors pressure, flow and various alarm systems; operates remote valves through electrical control panels; and maintains reservoir grounds.",,,,Two years,full-time,,,"with water systems facilities in construction, maintenance, or operations;",,P,,OPEN_INT_PROM,"$55,415","$68,841",,"1. Two years of full-time paid experience with water systems facilities in construction, maintenance, or operations; or
2. Two years of full-time paid experience operating or maintaining large irrigation systems.","THURSDAYJULY 13, 2017",06-30-17,55415.0,68841.0,2017,6,2
WATERWORKS ENGINEER 7248 071516 (1).txt,WATERWORKS ENGINEER,7248,,,"A Waterworks Engineer plans, organizes, and directs the work of engineers and other personnel engaged in planning, constructing, maintaining, and operating waterworks facilities and structures;  oversees and directs engineers and other personnel engaged in water resource planning, water quality compliance or water system operations; oversees and directs the preparation of specifications, designs, plans, estimates, environmental studies, reports, and hydrologic surveys; applies sound supervisory principles and techniques in building and maintaining an effective work force; and fulfills equal employment opportunity responsibilities.",,,,,,,,,,P,,INT_DEPT_PROM,"$116,740","$145,032",,,"THURSDAYJULY 28, 2016",07-15-16,116740.0,145032.0,2016,7,0
REFUSE CREW FIELD INSTRUCTOR 4100 081216.txt,REFUSE CREW FIELD INSTRUCTOR,4100,1,,"The Refuse Crew Field Instructor trains and instructs refuse collection personnel on proper and safe collection methods and practices, including the operation of refuse collection trucks and specialized equipment. The Refuse Crew Field Instructor also provides support to district safety programs, conducts classroom training, documents all required applied training, monitors safe work practices in the field, and supports daily investigation and observations targeted at reducing on-duty injuries and vehicle accidents.  These positions normally work with one crew at a time, but may be assigned to instruct groups of Refuse Collection Truck Operators and other staff in the use of equipment or to instruct employees on other branches of refuse collection. This class is distinguished from other safety classes due to the specialized nature of the work performed.",,,,Two years,full-time,Refuse Collection,,with the City of Los Angeles as a Refuse Collection Truck Operator,,,,INT_DEPT_PROM,"$60,886","$86,631",,"1. Two years of full-time paid experience with the City of Los Angeles as a Refuse Collection Truck Operator; and 
2. A valid California Class B driver's license and valid medical certificate approved by the State of California Department of Motor Vehicles.","THURSDAYAUGUST 25, 2016",08-12-16,60886.0,86631.0,2016,8,2
LANDSCAPE ARCHITECT 7929 090718.txt,LANDSCAPE ARCHITECT,7929,,,"A Landscape Architect oversees and prepares professional landscape architectural plans, specifications, and cost estimates for the development and rehabilitation of City facilities; manages assigned projects and contracts; supervises employees engaged in this work; applies sound supervisory principles and techniques in building and maintaining an effective work force; and fulfills equal employment opportunity responsibilities.",,,,Two years,full-time,,,in a position at the level of Landscape Architectural Associate II,,R,,INT_DEPT_PROM,"$89,638","$131,064",,Two years of full-time paid professional landscape architectural experience in a position at the level of Landscape Architectural Associate II.,"THURSDAYSEPTEMBER 20, 2018",09-07-18,89638.0,131064.0,2018,9,2
SENIOR EXAMINER OF QUESTIONED DOCUMENTS 3231 072216 REVISED 072716.txt,WATER UTILITY SUPERINTENDENT,3980,,,"A Water Utility Superintendent plans, organizes and directs craft employees engaged in construction, maintenance, and operation activities within the Water Services Organization; applies sound supervisory principles and techniques in building and maintaining an effective work force; and fulfills equal employment opportunity responsibilities.",,,,Three years,full-time,,,"as a Water Utility Supervisor, Water Service Supervisor, Water Utility Operator Supervisor, Water Treatment Supervisor, or Waterworks Mechanic Supervisor with the City of Los Angeles. Only applicants that are currently or have previously worked in the Department of Water and Power in DDR numbers 92-39133, 93-39129, 93-39131, 93-39132, 93-39134, 93-39044, 93-39043, 93-39124, 93-39122, 93-39123, 93-58131, 93-58130, 93-58129, 93-58107, 93-58115, 93-39104, or 93-39103, and meet the above noted requirements qualify to take this examination",,R,,INT_DEPT_PROM,"$119,433","$148,394",,"Three years of full-time paid experience as a Water Utility Supervisor, Water Service Supervisor, Water Utility Operator Supervisor, Water Treatment Supervisor, or Waterworks Mechanic Supervisor with the City of Los Angeles. Only applicants that are currently or have previously worked in the Department of Water and Power in DDR numbers 92-39133, 93-39129, 93-39131, 93-39132, 93-39134, 93-39044, 93-39043, 93-39124, 93-39122, 93-39123, 93-58131, 93-58130, 93-58129, 93-58107, 93-58115, 93-39104, or 93-39103, and meet the above noted requirements qualify to take this examination.","THURSDAYAUGUST 18, 2016",07-29-16,119433.0,148394.0,2016,7,3
PRINCIPAL LIBRARIAN 6155 032417 REV 040417.txt,PRINCIPAL LIBRARIAN,6155,1,,"A Principal Librarian plans, organizes, directs, and supervises the work of library personnel at regional and neighborhood branch libraries, a Central Library department, or system-wide level, including Engagement and Learning, Emerging Technologies and Collections, or in a specialized library administrative function; ensures strategic goals and objectives are accomplished; represents and advocates for the library at community events and among diverse constituencies; may represent the Library Department and speak before elected officials, potential donors, and other public and private organizations; may interact with community based organizations and support groups, other city departments, vendors and contractors; plans, implements and reviews budgetary expenditures; applies sound supervisory principles and techniques in building and maintaining an effective work force; and fulfills equal employment opportunity responsibilities.",,,,Two years,full-time,,,as a Senior Librarian with the City of Los Angeles;,,P,,OPEN_INT_PROM,"$83,938","$119,413",,"1. Two years of full-time paid professional experience as a Senior Librarian with the City of Los Angeles; or
2. A master's degree in Library Science or Library and Information Science from a school accredited by the American Library Association and two years of full-time paid professional librarian experience at the level of Senior Librarian with the City of Los Angeles, directly supervising a group of professional library employees providing public service, technical services, or a staff specializing in adult, young adult, or children's library work.","THURSDAYAPRIL20, 2017",03-24-17,83938.0,119413.0,2017,3,2
PRINCIPAL RECREATION SUPERVISOR 2464 021618.txt,PRINCIPAL RECREATION SUPERVISOR,2464,,,"A Principal Recreation Supervisor directs and supervises area recreational programs or specialized Citywide recreational activities; applies sound supervisory principles and techniques in building and maintaining an effective work force, and fulfills equal employment opportunity responsibilities.",,,,Two years,full-time,,,"as a Recreation Supervisor or Aquatic Director, or in a class at that level directing or supervising recreational activities",,R,,INT_DEPT_PROM,"$73,163","$106,947",,"Two years of full-time paid experience as a Recreation Supervisor or Aquatic Director, or in a class at that level directing or supervising recreational activities.","THURSDAYMARCH 1, 2018",02-16-18,73163.0,106947.0,2018,2,2
SENIOR ELECTRIC TROUBLE DISPATCHER 3829 100716.txt,SENIOR ELECTRIC TROUBLE DISPATCHER,3829,,,"A Senior Electric Trouble Dispatcher assigns, reviews, and evaluates the work of a small group of employees on an assigned shift engaged in receiving and analyzing electric trouble complaints, dispatching personnel and equipment to clear and repair the trouble and restore service, operating various computer systems and updating databases related to computerized Electric Trouble Dispatching, and arranging for and issuing Work Authorities on the Department's overhead and underground 7,500-volt and below electrical system; approves plans and schedules for switching on the Department's distribution system; applies sound supervisory principles and techniques in building and maintaining an effective work force; fulfills equal employment opportunity responsibilities; and may also be assigned to other duties for training purposes or to meet technological changes or emergencies.",,,,Two years,full-time,,,as an Electric Trouble Dispatcher with the City of Los Angeles,,P,,INT_DEPT_PROM,"$85,545","$106,279",,Two years of full-time paid experience as an Electric Trouble Dispatcher with the City of Los Angeles.,"THURSDAYOCTOBER 20, 2016",10-07-16,85545.0,106279.0,2016,10,2
METER READER 1611 080715.txt,METER READER,1611,,,"A Meter Reader works outdoors; reads water and electric meters and makes accurate recordings of those readings using a hand-held computer; reports irregularities found in the field; and deals tactfully and courteously with customers in answering their inquiries and complaints regarding service.

Candidates should have good eyesight and must be in good physical condition since Meter Readers work alone in the field; walk in excess of seven miles per day in hilly and flat terrain; squat and bend approximately 150 times per day; climb multiple flights of stairs; carry approximately 10 pounds of equipment all day; lift and slide water meter lids weighing approximately 10 to 25 pounds on a regular basis; work in all types of inclement weather, including rain and extreme heat; must contend with hostile dogs; and frequently must read meters under unfavorable conditions such as through a screen in poor light, or at a distance using a scope or mirror; the ability to memorize various alpha and numeric codes is especially desired; may work overtime, including weekends as scheduled.",,,,,,,,,,,,OPEN,"$56,041","$69,634",,,"SUNDAYSEPTEMBER 20, 2015",08-07-15,56041.0,69634.0,2015,8,0
REAL ESTATE OFFICER 1960 051118.txt,REAL ESTATE OFFICER,1960,1,,"A Real Estate Officer negotiates for the lease, acquisition, rental, or sale of real property rights; makes valuation appraisals of real property to be acquired, sold or leased by the City; selects or assists in the selection of appropriate sites or routes for public projects; appraises damages including loss of goodwill and special benefits to private and public property resulting from proposed public improvements or public utility installations; manages City-owned real property; and coordinates property management issues for leased facilities; conducts relocation studies; and relocates persons and/or businesses.",,college,"one or more of the following areas:
a)  	negotiating for the lease, rental, acquisition, or sale of commercial, residential and/or industrial real property rights;
b)  	appraising the market value of real property including land and improvements and good will when applicable;
c)  	managing commercial or industrial real property",One year,full-time,,,as a Real Estate Associate with the City of Los Angeles;,,P,,OPEN_INT_PROM,"$70,490","$103,084","$88,823 to $110,329","1. One year of full-time paid experience as a Real Estate Associate with the City of Los Angeles; or
2. Three years of full-time paid experience as a Real Estate Trainee with the City of Los Angeles; or
3. Graduation from an accredited four year college or university; and two years of full-time paid experience in one or more of the following areas:
a)  	negotiating for the lease, rental, acquisition, or sale of commercial, residential and/or industrial real property rights;
b)  	appraising the market value of real property including land and improvements and good will when applicable;
c)  	managing commercial or industrial real property;
d) providing relocation assistance to persons or businesses.","THURSDAYMAY 24, 2018",05-11-18,70490.0,103084.0,2018,5,1
SENIOR COMMUNICATIONS ENGINEER 7614 060917.txt,SENIOR COMMUNICATIONS ENGINEER,7614,1,,"A Senior Communications Engineer plans, organizes, and directs the activities of technical and professional employees engaged in the preparation of plans, designs, specifications, estimates and cost and service studies, for new communication systems and major systems modifications and for the construction, operation, and management of communication facilities; applies sound supervisory principles and techniques in building and maintaining an effective workforce; and fulfills equal employment opportunity responsibilities.",,,,Two years,full-time,,,"as a Communications Engineer or in a class at that level, which provides experience in the design and installation of radio, telephone, VoIP, microwave, alarm, data, signal, CCTV, access control, Cable TV, public address systems and intercoms, fiber optic networks, copper and coax cable systems, or other transmitting facilities;",,R,,INT_DEPT_PROM,"$105,444","$149,981",,"1.  Two years of full-time paid professional experience as a Communications Engineer or in a class at that level, which provides experience in the design and installation of radio, telephone, VoIP, microwave, alarm, data, signal, CCTV, access control, Cable TV, public address systems and intercoms, fiber optic networks, copper and coax cable systems, or other transmitting facilities; or
2.  Four years of full-time paid professional experience in a position at the level of Communications Engineering Associate III, supervising professional staff in the design and installation of radio, telephone, VoIP, microwave, alarm, data, signal, CCTV, access control, Cable TV, public address systems and intercoms, fiber optic networks, copper and coax cable systems, or other transmitting facilities.","THURSDAYJUNE 22, 2017",06-09-17,105444.0,149981.0,2017,6,2
WATER UTILITY OPERATOR SUPERVISOR 5857 062918.txt,WATER UTILITY OPERATOR SUPERVISOR,5857,1,,"A Water Utility Operator Supervisor supervises and personally participates in the operation and maintenance of electric water pumping plants, reservoirs, wells and related water facilities, monitors the operation of computerized Supervisory Control and Data Acquisition System (SCADA); applies sound supervisory techniques in building and maintaining an effective work force, and fulfills equal employment opportunity responsibilities.",,,,Four years,full-time,,,"in a position at the level of Water Utility Operator, two years of which must be with the City of Los Angeles, operating and maintaining potable water pump stations, wells, tanks, reservoirs, and related facilities and equipment",,R,,INT_DEPT_PROM,"$93,041","$98,219",,"1. Four years of full-time paid experience in a position at the level of Water Utility Operator, two years of which must be with the City of Los Angeles, operating and maintaining potable water pump stations, wells, tanks, reservoirs, and related facilities and equipment; and
2. A California State Water Resources Control Board (SWRCB), Division of Drinking Water certificate as a Distribution Operator Grade 2 or higher is required for the entire four years of qualifying experience.","THURSDAYJULY 12, 2018",06-29-18,93041.0,98219.0,2018,6,4
APPRENTICE - METAL TRADES 3789 070816.txt,APPRENTICE - METAL TRADES,3789,,,"An Apprentice - Metal Trades works as an apprentice in a specific metal trade, receives on-the-job training assisting a journey-level Sheet Metal Worker, Structural Steel Shop Worker, Blacksmith, Welder, or Auto Body Builder and Repairer; attends approved classroom instruction during off duty hours.",,,,,,,,,,R,,OPEN_INT_PROM,"$63,036","$81,056",,,"THURSDAYJULY 21, 2016",07-08-16,63036.0,81056.0,2016,7,0
SENIOR CONSTRUCTION ENGINEER 7289 042514.txt,SENIOR CONSTRUCTION ENGINEER,7289,1,,A Senior Construction Engineer directs a large group of professional engineers and technical staff engaged in managing the activities of contract construction projects; assists in administering a contract construction program for the Department of Public Works; applies sound supervisory principles and techniques in building and maintaining an effective work force; fulfills equal employment opportunity responsibilities; and acts as assistant division engineer and may act as division engineer.,,,,Two years,full-time,,,"as a civil engineer, architect, or in a class at least at that level which provides experience in the design or construction of commercial, industrial, or public buildings, or large wastewater treatment plant facilities;",,P,,INT_DEPT_PROM,"$109,098","$135,553",,"1. Registration as a Civil or Professional Engineer with the California Board of Engineers, or possession of a valid certification of registration as an Architect issued by the California State Board of Architectural Examiners ; and either
2. Two years of full-time paid professional experience as a civil engineer, architect, or in a class at least at that level which provides experience in the design or construction of commercial, industrial, or public buildings, or large wastewater treatment plant facilities; or
3. Two years of full-time paid experience with the City of Los Angeles in a position designated as a Project Manager I, II, or III receiving the appropriate salary bonus.","THURSDAYMAY 8, 2014",04-25-14,109098.0,135553.0,2014,4,2
DIRECTOR OF AIRPORTS ADMINISTRATION 9302 012717.txt,DIRECTOR OF AIRPORTS ADMINISTRATION	REVISED,9302,1,,"Plans, directs, and coordinates the administrative activities of the Department of Airports.",,,,Two years,full-time,,,"with the City of Los Angeles at the level of Chief Management Analyst supervising staff engaged in human resources management; budget and financial planning; RFP and contract development, review and administration; or airport operations;",,R,,INT_DEPT_PROM,"$141,859","$201,868",,"1. Two years of full-time paid experience with the City of Los Angeles at the level of Chief Management Analyst supervising staff engaged in human resources management; budget and financial planning; RFP and contract development, review and administration; or airport operations; or 
2. Three years of full-time paid experience with the City of Los Angeles, Department of Airports at the level of Senior Management Analyst II supervising staff engaged in human resources management; budget and financial planning; RFP and contract development, review and administration; or airport operations; or
3. Three years of full-time paid experience with the City of Los Angeles, Department of Airports as an Executive Assistant Airports, representing Airport executive management on operational, administrative, or community relations issues.","THURSDAYFEBRUARY 9, 2017",01-27-17,141859.0,201868.0,2017,1,2
